{
  "export_id": "source-pilot-decision-packets-2026-05-21-v075d",
  "status": "decision_packets_ready",
  "mode": "fixture_only",
  "checked_at": "2026-05-21T10:00:00.000Z",
  "source_count": 2,
  "candidate_count": 1,
  "packet_count": 1,
  "packets": [
    {
      "packet_id": "sp-packet-sp-review-edpb-publications-rss-edpb-fixture-003-fixture",
      "candidate_id": "sp-review-edpb-publications-rss-edpb-fixture-003-fixture",
      "source_id": "edpb-publications-rss",
      "source_name": "European Data Protection Board (EDPB) — publications RSS",
      "jurisdiction": "eu",
      "source_type": "rss",
      "official_url": "https://www.edpb.europa.eu/news/news/2026/edpb-fixture-003",
      "candidate_status": "new_metadata_detected",
      "reviewer_status": "pending_review",
      "packet_status": "blocked_no_supabase",
      "packet_created_at": "2026-05-21T12:00:00.000Z",
      "change_type": "added",
      "detected_at": "2026-05-21T10:00:00.000Z",
      "title": "EDPB new publication notice (fixture v2 — new item)",
      "metadata_fields_changed": [
        "item_added"
      ],
      "previous_metadata_hash": "78464abc15c407b5",
      "current_metadata_hash": "8875ea2c41173b83",
      "operator_checklist": [
        {
          "id": "confirm_fixture_context",
          "label": "Confirm fixture-only simulated change (not live fetch)",
          "required": true,
          "completed_placeholder": false
        },
        {
          "id": "review_metadata_fields",
          "label": "Review metadata_fields_changed against prior/current hashes",
          "required": true,
          "completed_placeholder": false
        },
        {
          "id": "confirm_registry_url",
          "label": "Confirm official_url matches allowlisted registry entry",
          "required": true,
          "completed_placeholder": false
        },
        {
          "id": "no_legal_conclusion",
          "label": "Do not record legal change conclusion or client/evidence approval",
          "required": true,
          "completed_placeholder": false
        },
        {
          "id": "triage_label",
          "label": "Assign offline triage label (placeholder only — not persisted)",
          "required": false,
          "completed_placeholder": false
        }
      ],
      "manual_review_steps": [
        "Open packet summary and confirm candidate_id links to review export.",
        "Compare previous_metadata_hash and current_metadata_hash (fixture simulation only).",
        "Inspect title and official_url metadata — do not treat as verified legal text.",
        "Record operator triage intent using decision placeholders (offline; not persisted).",
        "If Supabase becomes available, defer persistence to T075B runtime queue.",
        "If network check approved later, defer verify-on-source to T076+ controlled check."
      ],
      "blocked_until": [
        "supabase_not_configured",
        "network_execution_disabled",
        "source_not_verified_on_source",
        "evidence_gates_closed",
        "publication_gates_closed",
        "no_legal_conclusion_allowed",
        "fixture_only_no_live_ingestion"
      ],
      "safety_flags": {
        "verified_on_source": false,
        "client_use_allowed": false,
        "client_evidence_allowed": false,
        "final_evidence_allowed": false,
        "legal_change_claimed": false,
        "publication_allowed": false,
        "public_export_allowed": false
      },
      "runtime_flags": {
        "live_ingestion_enabled": false,
        "scheduled_monitoring_enabled": false,
        "network_execution_enabled": false
      },
      "decision_placeholders": {
        "mark_for_manual_inspection": {
          "label": "Mark for manual inspection (offline triage)",
          "selected_placeholder": false,
          "note_placeholder": "Operator intent only — not persisted; does not approve evidence or publication."
        },
        "request_source_verification_later": {
          "label": "Request source verification later (when network approved)",
          "selected_placeholder": false,
          "note_placeholder": "Defer verify-on-source until Control Tower approves controlled network check."
        },
        "keep_blocked": {
          "label": "Keep blocked (gates remain closed)",
          "selected_placeholder": false,
          "note_placeholder": "Retain blocked state; no client/evidence/publication use until explicit later gates."
        },
        "discard_fixture_candidate": {
          "label": "Discard fixture candidate (simulation only)",
          "selected_placeholder": false,
          "note_placeholder": "Mark fixture diff as non-actionable for pilot — does not delete registry fixtures."
        }
      },
      "public_note": "T075D offline decision packet. Metadata-only fixture context for operator triage. Not verified on source; not legal change; not evidence; not publication-approved."
    }
  ],
  "runtime_flags": {
    "live_ingestion_enabled": false,
    "scheduled_monitoring_enabled": false,
    "network_execution_enabled": false
  },
  "gates": {
    "verified_on_source": false,
    "client_use_allowed": false,
    "client_evidence_allowed": false,
    "final_evidence_allowed": false,
    "legal_change_claimed": false,
    "publication_allowed": false,
    "public_export_allowed": false
  },
  "public_note": "T075D offline source pilot decision packet export. Metadata-only fixture context for manual operator triage; no network; no Supabase persistence; no full legal text. Evidence and publication gates remain closed."
}
